data_id,darija_arabic,darija_arabizi,modern_standard_arabic,status,id,classe,english,english_word_count
data55034,الرحيل ديال البريطانيين سالا النشاطات العسكرية الكبيرة فالمستعمرات ديال نيو إنجلاند. واشنطن، خايف من البريطانيين يهاجمو مدينة نيويورك، مشا ف 4 أبريل مع الجيش ديالو لمنهاتن، وبدا الحملة ديال نيويورك ونيو جيرسي.,"rrahil dyal britaniyyeen sala nshatat 3askariyyeen lkibara flmosta3marat dyal new england. washington, khaayf mn britaniyyeen yhajmu mdint new york, msha f 4 abril m3a ljeesh dyalo l manhattan, ubda l7amla dyal new york w new jersey.",أنهى انسحاب البريطانيين الأنشطة العسكرية الكبرى في مستعمرات نيو إنجلاند. واشنطن، خشية أن يهاجم البريطانيون مدينة نيويورك، غادر في 4 أبريل بجيشه إلى مانهاتن، ليبدأ حملة نيويورك ونيو جيرسي.,VALIDATED,WIKI_D_06174,D,"The British departure ended major military activities in the New England colonies . Washington , fearing that the British were going to attack New York City , departed on April 4 with his army for Manhattan , beginning the New York and New Jersey campaign .",32
data55035,كان كيسحاب ليا غادي يستعرض علينا المهارات ديالو,kan kis7ab liya ghadi yste3red 3lina lmaharat dialo,ظننت أنه سيظهر مهاراته,VALIDATED,DATA_10281,A,i thought that he will show his skills,8
data55036,الحموضة ديال المعدة هي وحدة من الإفرازات الرئيسية ديالها. كتكون بالأساس من حمض الهيدروكلوريك وكتحمض داكشي اللي فالمعدة حتى كتولي نسبة الحموضة بين واحد وجوج.,l7modda dyal lma3da hi wa7da mn l frazat rayisia dyalha. katkon bil asasa mn 7amd l hydrochlorique w katkhamad dakchi li f lma3da 7ta katwali nassbat l 7modda bin wa7d w joj.,حمض المعدة هو أحد الإفرازات الرئيسية للمعدة. ويتكون بشكل أساسي من حمض الهيدروكلوريك ويُحمّض محتويات المعدة إلى درجة حموضة تتراوح بين 1 و 2.,VALIDATED,WIKI_C_05466,C,Gastric acid is one of the main secretions of the stomach . It consists mainly of hydrochloric acid and acidifies the stomach content to a pH of 1 to 2 .,25
data55037,بزاف ديال الكساوي فيهم سفنج ولا شي حاجة باش يعطيو الكاركتير الفورمة اللي بغاو (هادشي كيكون بالخصوص ف الكاركتيرات اللي كبار ولا ديال شي جنس معين).,bzaf dyal lksawiyy fihom sfanj wlla chi haja bach y3tiw lkarakter lform dyal li bghaw (hadchi kaykon blkhsus f lkaraktiratt lli kbar wlla dyal chi jins mo3ayyan).,تتضمن العديد من الأزياء حشوات خاصة أو غير ذلك لإعطاء الشخصية شكلها المرغوب (وهذا ملحوظ بشكل خاص في الشخصيات الكبيرة أو تلك التي تنتمي إلى جنس معين).,VALIDATED,WIKI_C_00848,C,Many suits include special padding or <unk> to give the character its desired shape ( this is especially present in larger characters or those of a particular gender ) .,26
data55038,المطاعم ديال فروم فيها الأرشينجل اللي كاين في شارع كينج، واللي خدا 9 على 10 في جريدة صنداي تلغراف. الأرشينجل كانت شحال هادي لونسيان آنجل وكيظنوا باللي التاريخ ديالها كيرجع حتى قبل الإصلاح البروتستانتي، وهي مصنفة من الدرجة الثانية في المباني التاريخية.,"lmatam dyal from fi l'archangel lli kayen f charia king, wlli khda 9 3la 10 f jridet sunday telegraph. l'archangel kanet sh7al hadi l'ancien angel w kaydnu bli tarikh dyalha kayrja3 hata qbel lislah l'protestant, w hiya msnfa mn drja tania f lmabani tarikhiya.",تشمل مطاعم فروم مطعم آرتشانجل في شارع كينج، والذي حصل على تقييم 9/10 في صحيفة صنداي تلغراف. كان آرتشانجل في السابق فندق آنجل إن، ويعتقد أن تاريخه يعود إلى ما قبل الإصلاح البروتستانتي، وهو مبنى مدرج من الدرجة الثانية.,VALIDATED,WIKI_D_11930,D,"Frome restaurants include the Archangel on King Street , which received a 9 / 10 rating in The Sunday Telegraph . The Archangel was formerly The Angel Inn and is believed to date back to before the Protestant Reformation , and is a Grade II listed building .",42
data55039,"أڤاتار آنݣ ( <unk> ، آن <unk> ) شخصية خيالية وهو الشخصية الرئيسية ديال المسلسل التلفزيوني المتحرك ديال نيكلوديون ""أڤاتار: ذا لاست إيربندر"" (لي تخلق من طرف مايكل دانتي ديمارتينو و براين كونيتزكو)، و دارو ليه الصوت زاك تايلر آيزن.","avatar aang ( <unk> , aan <unk> ) shakhsiya khayaliya w howa shakhsiya rayissiya dyal l'mslslt tlfzyoni l'mthrk dyal nickelodeon ""avatar: the last airbender"" (li tkhalaq mn tarf michael dante dimartino w bryan konietzko), w daro lih l'swt zach tyler eizen.","أفاتار آنغ ( <unk> ، آن <unk> ) شخصية خيالية والبطل الرئيسي للمسلسل التلفزيوني المتحرك من إنتاج نيكلوديون ""أفاتار: آخر رجل يستطيع التحكم بالعناصر"" (من ابتكار مايكل دانتي ديمارتينو وبراين كونيتزكو)، أدى صوته زاك تايلر آيزن.",VALIDATED,WIKI_D_05628,D,"Avatar Aang ( <unk> , ān <unk> ) is a fictional character and the protagonist of Nickelodeon 's animated television series Avatar : The Last Airbender ( created by Michael Dante DiMartino and Bryan Konietzko ) , voiced by Zach Tyler Eisen .",40
data55040,حيرام سيمبسون، واحد قريب بعيد ديال عائلة سيمبسون، لي ترشا بواحد الصباط جديد باش يڭول فين كاين ڤيرجيل.,"Hiram Simpson, wa7ed qrib b3id dyal 3a'ilat Simpson, li trsha bwa7ed ssebbat jdid bash ygoul fin kayn Virgil.",هيرام سيمبسون، قريب بعيد لعائلة سيمبسون تم رشـوته بزوج جديد من الأحذية للكشف عن مكان فيرجيل.,VALIDATED,DATA_22870,B,"Hiram Simpson , a distant relative of the Simpson family who was bribed with a new pair of shoes into revealing Virgil 's whereabouts .",25
data55041,المركب د التداريب د النادي كاين ف <unk> كروس، ف طريق غرانج، ڭيلينڭهام. ف 2012 النادي كان متورط ف نزاع مع المجلس المحلي، اللي ادّاعاو باللي ڭيلينڭهام مسال ليهم كثر من 30 ألف پوند ف الفاكتورة اللي ما مخلصاش ديال هاد المرفق.,"l merkeb d tdarib d n-nadi kayen f <unk> kros, f tariq greej, ġilinġam. f 2012 n-nadi kan mtwert f nzay3 m3 l-majles l-m7alli, li dda3aw bl-li ġilinġam mssal lihom kter men 30 alf pound f l-faktura li ma mkhlessash dyal had l-marfaq.",يقع ملعب تدريب النادي في <unk> كروس، في طريق غرانج، في جيلينغهام. في عام 2012، كان النادي متورطًا في نزاع مع المجلس المحلي، الذي زعم أن جيلينغهام مدين بأكثر من 30 ألف جنيه إسترليني في فواتير غير مدفوعة تتعلق بالمرفق.,VALIDATED,WIKI_D_08720,D,"The club 's training ground is <unk> Cross , in Grange Road , Gillingham . In 2012 the club was involved in a dispute with the local council , who alleged that Gillingham owed over £ 30 @,@ 000 in unpaid bills relating to the facility .",42
data55042,الإشارة لموقع الأحداث ف هونج كونج جات ف المشهد اللي الشخصيات فيه كتشرب سان ميغيل، اللي هو ماركة ديال البيرة معروفة بزاف ف ديك المدينة الكبيرة ديال شرق آسيا.,"l-ishara l-mowqi3 l-ahdath f hong kong jat f l-mshhed li sh-shkhsiat fih ketchreb san miguel, li huwa marka dyal l-bira ma3rofa bzzaf f dik l-mdina l-kbira dyal sharq asia.",يُلمح إلى أجواء هونغ كونغ بالمشهد الذي يشرب فيه الشخصيات بيرة سان ميغيل، وهي مادة أساسية ثقافية في المدينة العملاقة شرق آسيا.,VALIDATED,DATA_12861,B,The Hong Kong setting is alluded to by the scene wherein the characters are drinking San Miguel Beer a cultural staple of the East Asian megalopolis .,27
data55043,واش إلى كان ؟ هو الكتاب الثاني ديال مونرو لي تنشر، الأول ديالو كان <unk> : المجلد 0، مجموعة مختارة من رسوم xkcd لي صدرات عام 2009. مونرو صدر كتاب ثالث، سميتو شيء <unk>، في 2015.,"wash ila kan? huwa lktab t-tani dyal munro li t-nchur, l-awwel dyalu kan <unk>: l-mujallad 0, majmu3a mukhtara men rusum xkcd li sdat 3am 2009. munro sdar ktab talt, smito shay2 <unk>, f 2015.",ماذا لو؟ هو الكتاب الثاني المنشور لـ مونرو، وكان كتابه الأول <unk>: المجلد 0، وهي مجموعة منتقاة من رسوم xkcd نُشرت عام 2009. أصدر مونرو كتابًا ثالثًا، بعنوان شيء <unk>، في عام 2015.,VALIDATED,WIKI_D_11750,D,"What If ? is Munroe 's second published book , his first being <unk> : Volume 0 , a curated collection of xkcd comics released in 2009 . Munroe released a third book , titled Thing <unk> , in 2015 .",36
data55044,١٩٥٩: تفتحات لمونوريل، طوموبيلات Turnpike و ويلد ماوس. تسدات نوح أرك. سالات البني ديال مارينا سيدار بوينت.,"1959: tft7at lmonorail, tomobilaat Turnpike o wild mouse. Tsddat Noah's Ark. Salat lbni dial Marina Cedar Point.",١٩٥٩: يفتح قطار المونوريل، وسيارات التورنبايك، والفأر البري؛ ويغلق سفينة نوح؛ ويكتمل إنشاء مرسى سيدار بوينت.,VALIDATED,DATA_23825,B,"1959 : Monorail , Turnpike Cars , and Wild Mouse opens ; Noah 's Ark closes ; Construction is completed on the Cedar Point Marina",25
data55045,ماكي، ريتشارد سومرست (١٩٩٧). التجارة من وراء الجبال: تجارة الفرو البريطانية في المحيط الهادئ ١٧٩٣-١٨٤٣. فانكوفر: جامعة كولومبيا البريطانية (UBC) للطباعة. ISBN 0 @-@ <unk> @-@ <unk> @-@ 3.,"makki, richard somerset (1997). ttijara mn wara j-jibala: ttijara dyal l-frou li-brittaniya f l-muhit l-hadi 1793-1843. vanikur: jami3at columbia l-brittaniya (ubc) dyal ttiba3a. isbn 0 @-@ <unk> @-@ <unk> @-@ 3.",ماكي، ريتشارد سومرست (١٩٩٧). التجارة من وراء الجبال: تجارة الفرو البريطانية على ساحل المحيط الهادئ ١٧٩٣-١٨٤٣. فانكوفر: مطبعة جامعة كولومبيا البريطانية (UBC). ISBN 0 @-@ <unk> @-@ <unk> @-@ 3.,VALIDATED,WIKI_D_00849,D,"Mackie , Richard Somerset ( 1997 ) . Trading Beyond the Mountains : The British Fur Trade on the Pacific 1793 – 1843 . Vancouver : University of British Columbia ( UBC ) Press . ISBN 0 @-@ <unk> @-@ <unk> @-@ 3 .",29
data55046,السيد المسؤول على الشاطئ رفع راية زرقا فوق راسو باش يعلم الربان ديال السفينة بلي راه واجد باش يبدا الإطلاق.,s-sid l-mas2ul 3la sh-shati rfa raia zarqa fuq ras-u bash y3allem r-robban dial s-sfina belli rah wajed bash yebda l-itlaq.,رفع كبير ضباط البيانات علماً أزرق فوق رأسه لإعلام قبطان السفينة باستعداده للإطلاق.,VALIDATED,DATA_20739,B,The CDO raised a blue flag above his head to inform the ship 's master of his readiness to launch .,21
data55047,كون غير قدرت نسمعك هاد الأغنية.,koun ghir 9dert nsm3k had l oughnia.,لَيْتَنِي أُغَنِّي هَذِهِ الأُغْنِيَةَ,VALIDATED,DATA_9592,A,if only i sing this song,6
data55048,تماشيا مع اهتمام پروس بالتجارة والتكنولوجيا، واحد الباخرة ديال شركة البحار البولندية تسمات بسميتو.,"Tmashiyaan m'a ihtimam Bros b'tijara w'teknolojiya, wahed lbakhera dyal shirkat lbhar lbouloniya tesmat b'smitou.",تماشيًا مع اهتمام بروس بالتجارة والتكنولوجيا، تم تسمية سفينة شحن تابعة لشركة خطوط المحيط البولندية باسمه.,VALIDATED,DATA_24836,B,"Consonant with Prus ' interest in commerce and technology , a Polish Ocean Lines freighter has been named for him .",21
data55049,"فـ ١٩٩٥ ألفين والسنجاب و صحاباتو سجلوا كوفر ديال ""Be Our Guest"" لألبوم ديالهم لي فيه أغاني ديال ديزني سميتو When You Wish Upon a Chipmunk.","f 1995 alvin wchpmnks w chipettes recordo cover dyal ""Be Our Guest"" l album concept dyalhom dyal disney smito ""When You Wish Upon a Chipmunk"".","في عام ١٩٩٥، سجل أصدقاء السنجاب ورفيقاته أغنية ""كن ضيفنا"" لألبومهم المفهومي المستوحى من ديزني بعنوان ""عندما تتمنى على سنجاب"".",VALIDATED,WIKI_C_09313,C,"In 1995 , Alvin and the Chipmunks and The Chipettes recorded a cover of "" Be Our Guest "" for their Disney @-@ themed concept album When You Wish Upon a Chipmunk .",26
data55050,القْصور ديال الحجر كانت عرضة للعافية حيت كانو فيها بزاف ديال المواد اللي كتشعل. ف ١١٣٩، هنري دي تريسي جبر القصر ديال تورينݣتون باش يستسلم بواحد الطريقة ساهلة: رما الشعلات مشعولين من التقيبات ديال البرج الكبير.,"lqsur dyal l7jer kanu 3urda l3afya hit kanu fiha bzaf dyal lmawadd lli katch3el. f 1139, henry de tracy jber lqser dyal torrington bach ytslem bwa7d tariqa sahla: rma sh3alat msh3ulin mn tqbibat dyal lbruj lkbir.",كانت القلاع الحجرية عرضة للنيران، لاحتوائها على العديد من المواد القابلة للاشتعال. في عام ١١٣٩، أجبر هنري دي تريسي قلعة تورينغتون على الاستسلام بمجرد رمي المشاعل المشتعلة عبر فتحات السهم في البرج الرئيسي.,VALIDATED,WIKI_D_05967,D,"Stone castles were susceptible to fire , since they contained many combustible materials . In 1139 , Henry de Tracy forced the surrender of Torrington Castle by the simple expedient of tossing lighted torches through the keep 's loopholes .",36
data55051,كوبريك صور بزاف ديال المشاهد اللي تحيدو من الفيلم النهائي. هادو كيطيحو فجوج ديال الأنواع: المشاهد اللي تقطعات قبل ما يدار عرض عمومي للفيلم، والمشاهد اللي تقطعات شي يامات قليلة مورا العرض العالمي الأول ف ٢ أبريل ١٩٦٨.,"kubrik swer bzaf dyal lmshayed lli t7aydo mn lfilm lne2i. hado kayt77o f joj dyal l2nwa3: lmshayed lli tqtat3at qbl ma ydar 3rd 3momi lfilm, w lmshayed lli tqtat3at shi yyamat qlila mora l3rd l3alami l2wwel f 2 april 1968.",صور كوبريك العديد من المشاهد التي حذفت من الفيلم النهائي. تندرج هذه المشاهد ضمن فئتين: المشاهد التي تم اقتطاعها قبل أي عروض عامة للفيلم، والمشاهد التي تم اقتطاعها بعد أيام قليلة من العرض العالمي الأول في ٢ أبريل ١٩٦٨.,VALIDATED,WIKI_D_03686,D,"Kubrick filmed several scenes that were deleted from the final film . These fall into two categories : scenes cut before any public screenings of the film , and scenes cut a few days after the world premiere on April 2 , 1968 .",38
data55052,باش نحدّدو نسبة البورون ف الماكلة أولا ف شي مواد، كنستعملو طريقة الكوركومين اللونية. البورون كيتحول لحمض البوريك أولا البورات و فالتفاعل مع الكوركومين ف واحد المحلول حامضي، كيتكون واحد المركب كيلاطي أحمر اللون ديال البورون.,"bash nhadddu nsebt lboron f lmkla awla f chi mwadi, kanstamelu tari9t lkurkumun lloniyya. lboron k ythawwel l 7amud lburik awla lburaat, w f tafa3ol m3a lkurkumun f wa7d lma7lul 7amudi, kaytkon wa7d lmurakkab kilati 7mar lllon dyal lboron.",لتحديد محتوى البورون في الأطعمة أو المواد، تُستخدم طريقة الكركمين اللونية. يتم تحويل البورون إلى حمض البوريك أو البورات، وعند التفاعل مع الكركمين في محلول حمضي، يتكون مركب خلات البورون أحمر اللون.,VALIDATED,WIKI_D_00268,D,"For determination of boron content in food or materials the colorimetric curcumin method is used . Boron is converted to boric acid or borates and on reaction with curcumin in acidic solution , a red colored boron @-@ chelate complex , <unk> , is formed .",36
data55053,كون غير قدرت نخرج لكلب ديالي,koun ghir 9dert nkherej lklb diali,لو أنني أخذت كلبي للخارج,VALIDATED,DATA_9480,A,if only i took my dog outside,7
data55054,مانضنش غادي خرق دوك سيتات,mandench ghadi 5are9 dok sitat,لا أعتقد أنني سأقوم باختراق المواقع,VALIDATED,DATA_10567,A,I dont think i  will hack websites,7
data55055,أليكسيس دوبري، اللي تكلات ملكة جمال نيو مكسيك ف 2013 وعاودت ف 2015، هي من ألاموغوردو. ماي شانلي، اللي ولات ملكة جمال أمريكا ف 1984، مثلات المدينة بصفة ملكة جمال نيو مكسيك يو إس أي.,"alexis duprey, lli tklet malikat jamal new mexico f 2013 w 3awdet f 2015, hiya mn alamogordo. mai shanley, lli wlat malikat jamal america f 1984, mthlat mdina b siffat malikat jamal new mexico usa.",أليكسيس دوبري، التي توجت بلقب ملكة جمال نيو مكسيكو عام 2013 ومرة أخرى عام 2015، من ألاموغوردو. ماي شانلي، التي أصبحت ملكة جمال الولايات المتحدة الأمريكية عام 1984، مثلت المدينة بصفتها ملكة جمال نيو مكسيكو الأمريكية.,VALIDATED,WIKI_C_08079,C,"Alexis Duprey , crowned Miss New Mexico in 2013 and again in 2015 , is from Alamogordo . Mai Shanley , who became Miss USA 1984 , represented the city as Miss New Mexico USA .",35
data55056,"لونج ديال شركة هونغ كونغ إيرلاينز الجديد ""كلوب باوهينيا"" بدات الخدمة نهار 27 يونيو 2014.","lonj dial shirkat Hong Kong Airlines l-jdida ""Club Bauhinia"" bdat l-khdma nhar 27 yunyu 2014.","بدأت صالة طيران هونغ كونغ الجديدة ""كلوب باوهينيا"" عملياتها في السابع والعشرين من يونيو 2014.",VALIDATED,DATA_23946,B,"The brand new Hong Kong Airlines Lounge "" Club Bauhinia "" has started operations on June 27 , 2014 .",20
data55057,لفنار ديال الجزيرة الدائرية كاينة نيشان فالجنوب ديال الجزيرة، فالجزيرة الصغيرة و اللي ما ساكن فيها حد اللي سميتها الجزيرة الدائرية. الضو تبنى ف 1894 و ولا خدام أوتوماتيكيا ف 1924. بدات ترميمات كبيرة ف السبعينات و الشكل الخارجي و البنية تصلحو من ديك الساعة.,"lifnar dyal ljzira ddayriya kayna nishan faljonoob dyal ljzira, faljzira sghira w lli ma sakin fiha had lli smitha ljzira ddayriya. Ddo tsbna f 1894 w wala khdam otomatikan f 1924. bdat trmimat kbrira f sb3iniyat w shkl lokhari w lbnya tslho mn dik sa3a.",تقع منارة الجزيرة الدائرية جنوب الجزيرة مباشرة على جزيرة راوند الصغيرة غير المأهولة. بني الضوء عام 1894 وأتمت آلياته عام 1924. بدأت جهود ترميم واسعة في السبعينيات وتم إصلاح الواجهة الخارجية والهيكل منذ ذلك الحين.,VALIDATED,WIKI_D_03850,D,"The Round Island Lighthouse is located just south of the island on the small , uninhabited Round Island . The light was built in 1894 and automated in 1924 . Extensive restoration efforts began in the 1970s and the exterior and structure have since been repaired .",45
data55058,إدارة أمن النقل فميريكان كتنصح العيالات ما يلبسوش لي سوتيانات اللي فيهم الحديد حيت كيديرو مشكل فالديكتور ديال الميتال. واخا أغلبية العيالات اللي كيسافرو كيلبسوهم بلا مشكل، يقدر يعتمد على المادة اللي مصايب منها الحديد.,"idarat amn an-naql f-amrikan katensah l3iyalat ma yelbesouch li sotianat lli fihom l7did 7it kaydirou chkel f-detector dyal l metal. wakha aghlabiyat l3iyalat lli kesafro kilebsouhom bla chkel, yeqder y3tamad 3la l madda lli msayeb menha l 7did.",توصي إدارة أمن النقل الأمريكية بأن لا ترتدي النساء حمالات الصدر ذات الأسلاك الداعمة لأنها قد تثير أجهزة الكشف عن المعادن. وعلى الرغم من أن معظم المسافرات يرتدينها دون أي مشكلة، إلا أن الأمر قد يعتمد على مادة السلك الداعم.,VALIDATED,WIKI_D_08137,D,"The United States Transportation Security Administration recommends that women do not wear underwire bras because they can set off metal detectors . Though most women travelers wear them without any problem , it can depend on the material of the underwire .",35
data55059,تلاميد خرجو شي تمارين ديال الماذن,tlamed 5rjou chi tamarin dial lmaths,حل الطلاب بعض مسائل الرياضيات,VALIDATED,DATA_6356,A,the students have solved some mathematics problems,7
data55060,في 16 فبراير 2012، عبد المطلب، اللي كان اعترف بالذنب ولكن بقى ما نادمْش، تحكم عليه بالمؤبد بلا ما يخرج من الحبس نهائياً.,"fi 16 fibrayer 2012, Abdelmouttalib, lli kan a3taraf bddanb walakin bqa ma nademsh, t7ekm 3lih bel-mu'abbad bla ma ykhrej mn l7ebs nihai'yan.",في السادس عشر من فبراير 2012، حُكم على عبد المطلب، الذي أقر بالذنب ولكنه ظل غير نادم، بالسجن المؤبد دون إمكانية الإفراج المشروط.,VALIDATED,DATA_22705,B,"On February 16 , 2012 , Abdulmutallab , who had pleaded guilty but remained unrepentant , was sentenced to life in prison without the possibility of parole .",28
data55061,فالنظائر لي كوزن أقل من 103 (النظير المستقر)، طريقة التحلل الأساسية هي أسر الإلكترون والمنتوج الأساسي للتحلل هو الروثينيوم. فالنظائر لي كوزن كبر من 103، طريقة التحلل الأساسية هي انبعاث بيتا والمنتوج الأساسي هو البالاديوم.,"fel ndhayr lli koozn aql mn 103 (endhayr lmustqr), tri9at et7allol essasya hiya asr el elektron w lmnto9j el asasil l et7allol howa er rotinium. Fel ndhayr lli koozn kbr mn 103, tri9at et7allol essasya hiya enbi3at beta w lmnto9j el asasil howa el palladium.",في النظائر التي تزن أقل من 103 (النظير المستقر)، يكون وضع الاضمحلال الأساسي هو أسر الإلكترون، ويكون ناتج الاضمحلال الأساسي هو الروثينيوم. أما في النظائر التي تزن أكبر من 103، فيكون وضع الاضمحلال الأساسي هو انبعاث بيتا، ويكون الناتج الأساسي هو البالاديوم.,VALIDATED,WIKI_D_03229,D,"In isotopes weighing less than 103 ( the stable isotope ) , the primary decay mode is electron capture and the primary decay product is ruthenium In isotopes greater than 103 , the primary decay mode is beta emission and the primary product is palladium .",35
data55062,تعطلي بزّاف باش تغامر.,t3etli bezzaf bach tghaamer.,لقد فات الأوان للمخاطرة,VALIDATED,DATA_11036,A,you are too late to gamble,6
